Data;Texto;Autor(RT);Retweets;Curtidas;Hashtags;Mentions
2018-05-16 23:34:47;Quer enviar suas sugestões? Acesse nosso site e preencha o cadastro, é rapidinho! Clique aqui: https://t.co/EGnhbp0z0k. https://t.co/cWgqSmiMoz; ;14;110; ; ;
2018-05-14 22:27:38;Gostei muito da convocação da seleção brasileira. É claro que faltou alguém do meu Guarany de Sobral... mas confio no Tite. 😉  Só lamento a ausência de Daniel Alves, fora da lista por contusão.   Vou torcer muito para o hexa! #VaiBrasil; ;95;1551;#VaiBrasil; ;
2018-05-14 21:48:49;Qual o futuro das cotas nas universidades? O Ciro responde. https://t.co/SP3VDktT2q; ;104;492; ; ;
2018-05-13 14:27:57;O racismo continua existindo na nossa sociedade e precisa ser combatido diariamente. https://t.co/UmcVd6nRit; ;89;511; ; ;
2018-05-13 10:31:00;Muita saudade da minha querida mãe, Dona Mazé! https://t.co/7DN80dB4qh; ;25;1051; ; ;
2018-05-12 13:14:11;A Michelle está grávida do segundo filho e quer saber o que esperar para o futuro das crianças dela. #PergunteAoCiro https://t.co/as4Tf8ZzJN; ;37;201;#PergunteAoCiro; ;
2018-05-10 19:17:47;Acompanhe ao vivo o debate da #CNLE2018: https://t.co/6Kjx0sBDqb; ;15;132;#CNLE2018; ;
2018-05-10 17:25:07;Muito bom encontrar minha querida amiga Manuela e o querido amigo Boulos em Gramado, para debate durante a Unale.   Em instantes estaremos também com Alvaro Dias e Henrique Meirelles. https://t.co/nGPmNTfHzG; ;253;3076; ; ;
2018-05-10 14:53:51;A Thaís é mãe do Caio de 7 anos, moradora da periferia de São Paulo, e quer saber o que nós vamos fazer pra proteger o filho dela da violência que está a cada dia maior. #PergunteAoCiro https://t.co/h9kPXNcqhB; ;45;209;#PergunteAoCiro; ;
2018-05-08 11:00:16;Acesse o nosso site e confira a entrevista na íntegra!  https://t.co/v3TLk01Ftj; ;115;565; ; ;
2018-05-07 20:04:21;Hoje à noite tem Ciro Gomes no Band Eleições, logo depois do programa Viagens ao Redor do Mundo. Assista e convide seus amigos, a partir de 00h20.; ;166;913; ; ;
2018-05-05 17:09:52;Acesse o nosso site e confira a entrevista na íntegra: O IMPORTANTE É DERROTAR A DIREITA.  https://t.co/g2CngRBTEi; ;144;805; ; ;
2018-05-04 14:38:58;Como reduzir as desigualdades sociais? O Ciro responde.  https://t.co/NEf59Qz6Ra; ;63;373; ; ;
2018-05-03 00:56:32;Ciro Gomes tem 38 anos de vida pública. Já foi deputado, prefeito, governador e ministro, sem nunca ter tido seu nome associado a escândalos ou roubalheira. Ficha Limpa, Ciro Gomes tem, aos 60 anos, o preparo, a firmeza, a experiência e a honestidade que o Brasil precisa. https://t.co/N6ApfCDQRG; ;376;1618; ; ;
2018-05-01 11:46:49;Fiz questão de lançar o nosso site no #DiaDoTrabalho. Uma homenagem a todos os trabalhadores brasileiros! Acesse: https://t.co/c1EvSz16vE https://t.co/8UwywA2tjJ; ;269;1305;#DiaDoTrabalho; ;
2018-04-30 15:28:52;Acompanhe como foi a minha entrevista no programa @agoracomdatena!  #CiroNaBand  https://t.co/jvWHUY4RcK; ;34;213;#CiroNaBand;agoracomdatena;
2018-04-29 21:16:19;Acompanhe #aovivo Ciro Gomes na Band #agoraécomDatena #CiroNaBand; ;42;388;#agoraécomDatena, #aovivo, #CiroNaBand; ;
2018-04-29 20:15:43;Em instantes, às 18h, entrarei #aovivo com Datena, na TV Bandeirantes!   Acompanhe!!  https://t.co/Eul9PTrbyP; ;46;306;#aovivo; ;
2018-04-29 18:32:11;RT @agoracomdatena: Hoje tem live da entrevista do presidenciável @cirogomes  no Facebook do #AgoraÉComDatena: https://t.co/65SnFyIV1o http…;agoracomdatena;0;0;#AgoraÉComDatena;agoracomdatena, cirogomes;
2018-04-28 14:39:01;https://t.co/Dso3kT9QKo; ;236;1138; ; ;
2018-04-28 02:24:25;RT @SempreNa_Band: O candidato a presidência da república @cirogomes estará no #AgoraÉComDatena deste domingo às 15h na @BandTV! Não perca…;SempreNa_Band;0;0;#AgoraÉComDatena;BandTV, SempreNa_Band, cirogomes;
2018-04-27 22:52:12;Hoje foi um dia de intenso debate sobre o Brasil com trabalhadoras e trabalhadores da UGT e do Sindicato dos Metalúrgicos de São Paulo.  Essa luta é que vai fazer nosso país crescer, se desenvolver e gerar empregos! https://t.co/nGWtGEFG6N; ;61;580; ; ;
2018-04-27 10:07:43;Bom dia! Hoje é um dia especial de debate com trabalhadoras e trabalhadores em SP. Vamos falar sobre a luta contra a agenda golpista e sobre o futuro do Brasil.  9h30 - UGT Rua Martins Fontes, 330.  13h30 - Sindicato dos Metalúrgicos Rua Galvao Bueno, 782.  Participe!; ;52;656; ; ;
2018-04-24 23:42:27;Debate sobre o Brasil na Universidade Uninove, em São Paulo. https://t.co/FR7GUhG5NY; ;62;596; ; ;
2018-04-20 02:25:25;https://t.co/YUjsRSII9b; ;111;1276; ; ;
2018-04-19 22:45:27;Nesse 19 de abril, dia do índio, fui ao encontro dos Xavantes, no Mato Grosso. O Brasil deve muito aos povos indígenas. Cultura, identidade e resistência que são uma lição para todos nós. https://t.co/SNWT6ttvr4; ;61;446; ; ;
2018-04-19 09:33:42;Visitarei hoje as aldeias indígenas Guadalupe e São Marcos, em Mato Grosso.  Terra do grande Mário Juruna, primeiro e único deputado federal indígena do país, que também era filiado ao PDT.  Junto comigo estarão Carlos Lupi e Rafael Weree, presidente do movimento indígena do PDT.; ;72;846; ; ;
2018-04-17 18:52:17;O que venho alertando há tempos. Apesar de baixarem a taxa Selic, os juros na ponta quase não sofreram mudança.   É uma distorção grave em nosso país.  https://t.co/gFojyABlXr; ;117;561; ; ;
2018-04-16 23:09:54;Vamos falar sobre o Brasil, em Ouro Preto (MG). Acompanhe #aovivo em https://t.co/IhX6RkvkcH https://t.co/lddHobfmC6; ;37;406;#aovivo; ;
2018-04-16 09:54:25;Hoje, 19h, em Ouro Preto (MG).  Participe! https://t.co/60C3I2FFqw; ;60;571; ; ;
2018-04-14 18:18:57;Tod@s com o idioma japonês 🇯🇵 afiado? 😄 Então compartilho com vocês a entrevista que concedi ao jornal japonês Nikkei, especializado em economia.  Será que alguém pode me ajudar a traduzir? 🤓🤔❤️ Arigatou gozaimasu! 🙏 https://t.co/X2lzwBFGiK; ;83;762; ; ;
2018-04-14 14:48:41;RT @caetanoveloso: Uma beleza fazer show no aniversário de Fortaleza na praia de Iracema. Um anagrama de América e gritos de LULA LIVRE! @c…;caetanoveloso;0;0; ;caetanoveloso;
2018-04-14 14:41:11;Ontem Fortaleza comemorou 292 anos, com direito a show de Caetano Veloso no aterro da Praia de Iracema.  Maravilha! 👏👏🎼🎼 https://t.co/MXCzYmuPRt; ;48;694; ; ;
2018-04-11 16:17:24;Nesta quinta-feira, 18h, estarei na Câmara de Dirigentes Lojistas (CDL), em Fortaleza.  Participe! https://t.co/WaJSj1FuM6; ;30;374; ; ;
2018-04-10 21:02:28;RT @KennedyAlencar: Daqui a pouco, participo do @jornaldacbn2, entre 18h e 19h. Hoje tem entrevista com @cirogomes por volta das 18h30;KennedyAlencar;0;0; ;jornaldacbn2, KennedyAlencar, cirogomes;
2018-04-10 19:53:52;#entrevistaCBN  Concederei entrevista #aovivo hoje, 18h30, para Roberto Nonato e Kennedy Alencar, na CBN.  Acompanhe!; ;64;516;#aovivo, #entrevistaCBN; ;
2018-04-05 23:53:17;https://t.co/3vF5Ux3Vq8; ;1125;4135; ; ;
2018-04-04 17:04:51;https://t.co/ws9nrihQXb; ;157;854; ; ;
2018-04-02 22:29:14;Filiação da senadora Katia Abreu ao PDT ocorreu hoje. https://t.co/ZbYvkdAx5h; ;130;1147; ; ;
2018-03-29 19:06:12;Entrevista para Rádio France Internacional https://t.co/hpSiIhZPwG; ;65;251; ; ;
2018-03-29 09:42:00;RT @LaurenceCohen94: Échanges très enrichissants sur les perspectives politiques et sociales du #Brésil avec le candidat aux élections prés…;LaurenceCohen94;0;0;#Brésil;LaurenceCohen94;
2018-03-29 09:11:52;Foi uma honra na época estar ao lado de grandes artistas cearenses e é um grande prazer poder relembrar. 😊 https://t.co/ByZWc7028p; ;37;543; ; ;
2018-03-29 08:11:01;Bom dia! Gravei esta manhã em Paris entrevista para a Radio France Internacional.   Falamos sobre o grave momento que o Brasil vive, sobre as eleições e sobre o que temos que fazer para superar as crises política e econômica.   Ela irá ao ar logo mais e compartilharei com vocês! https://t.co/cuDFYjBup4; ;63;509; ; ;
2018-03-28 17:48:00;Reunião no Senado da França com o grupo de senadores franceses amigos do Brasil: Laurence Cohen, Georges Patient e Phillippe Dominati.  Conversamos sobre as relações entre Brasil e França e sobre o grave momento brasileiro. Vamos lutar e devolver a democracia e a paz ao Brasil! https://t.co/OQGL0A3wb1; ;53;353; ; ;
2018-03-28 17:35:39;Fui recebido hoje no Senado da França hoje para discutir com os senadores as relações Brasil-França e principalmente o momento grave que vivemos, com o assassinato de Marielle e o ataque à caravana do ex-presidente Lula. https://t.co/Ts7Z4CsLUZ; ;87;486; ; ;
2018-03-28 11:14:25;O ataque criminoso à caravana do ex-presidente Lula é absurdo e deve ser investigado com rigor. E repito a pergunta: quem matou Marielle?; ;659;2754; ; ;
2018-03-28 09:51:00;#aovivo na Universidade Sorbonne, em Paris.  Acompanhe!  https://t.co/4Qb86dkW6C; ;18;147;#aovivo; ;
2018-03-27 21:09:00;A gente se vira como pode pra ver o jogo do Brasil! 😄 Ótimo resultado! 🇧🇷🇩🇪 https://t.co/BcTXruC5gj; ;119;1431; ; ;
2018-03-27 18:16:43;Compartilho com vocês minha agenda de amanhã, em Paris. Além de um debate na Sorbonne às 10h (5h de Brasília), serei recebido na Assembleia Nacional Francesa por parlamentares franceses (deputados e senadores) e grupos de amizade Brasil-França.  Acompanhem https://t.co/xDxBbXvTQ3; ;36;250; ; ;
2018-03-27 17:49:53;Tive um dia muito agradável na Universidade de Sussex, em Brighton (Inglaterra). Além do debate,  gravei uma entrevista sobre economia política e relações internacionais com os doutorandos Thomás Patriota e Felipe Antunes, que será disponibilizada em breve. https://t.co/ejn2NBIj8z; ;24;212; ; ;
2018-03-27 12:48:15;#aovivo na Universidade de Sussex, na Inglaterra.  Acompanhe!  https://t.co/rAkpVQS1O7; ;22;134;#aovivo; ;
2018-03-27 00:50:53;Mais da visita ao Centro Espacial Universitário, em Montpellier: Nesta foto estou segurando um modelo em escala real de um nanosatélite. Tecnologia sensível que está sendo desenvolvida com o apoio de brasileiros. Investir em Ciência e Tecnologia é fundamental! https://t.co/cqg7mT3wqU; ;77;404; ; ;
2018-03-26 19:34:30;@xicoripoli @Marcocaete1 @PDT_Nacional Olá! O evento será às 13h (horário local, 09h de Brasília) no auditório A103 do edificio Arts A. 👍; ;0;0; ;Marcocaete1, PDT_Nacional, xicoripoli;
2018-03-26 19:27:32;Nesta terça-feira (27/03), participarei de um debate na Universidade de Sussex, em Brighton (Inglaterra). O evento será às 13h (horário local, 09h de Brasília) no auditório A103 do edificio Arts A. Acompanhe!; ;21;177; ; ;
2018-03-26 17:52:28;Visitei esta manhã em Montpellier (França) o instituto de sensoreamento remoto, ligado à unidade mista de Pesquisa para o Desenvolvimento (IRD), o Centro Espacial Universitário (CSU) e o Instituto de Eletrônica e Sistemas (IES). Veja mais informações: https://t.co/VpA1br5Uor; ;37;228; ; ;
2018-03-26 14:21:04;#aovivo debate na Universidade de Montpellier. Acompanhe!  https://t.co/8ovRAmHDEI; ;21;111;#aovivo; ;
2018-03-24 11:42:03;#aovivo debate com José Eduardo Cardoso e Christian Lohbauer, durante o Foro Brasil España, em Barcelona.   Acompanhe!  https://t.co/vJQj19JZPa; ;19;128;#aovivo; ;
2018-03-22 10:42:36;Bom dia. Inicio nesta sexta-feira viagem para participar de ciclo de debates em universidades européias.  Dia 24/03: Barcelona - Fórum Brasil Espanha.  Dia 26/03: Universidade de Montpellier.  Dia 27/03: Universidade de Sussex - Inglaterra.  Dia 28/03: Sorbonne, Paris  Acompanhe! https://t.co/kK7T1RR7Do; ;134;721; ; ;
2018-03-19 18:21:36;Entrevista que concedi ao Canal Rural: https://t.co/FW862YNnyg; ;56;254; ; ;
2018-03-19 15:44:10;Bom dia! Logo mais, 13h, vou conceder uma entrevista #aovivo para Kellen Severo, no programa Mercado e Companhia, do Canal Rural.   Acompanhe pelo link: https://t.co/C85QuXZ1Rf; ;15;111;#aovivo; ;
2018-03-17 22:34:08;Hoje o dia foi especial no Rio de Janeiro. Tive a honra de debater o Brasil e seus problemas com a brava gente da Frente Favela Brasil. Estão fazendo um lindo trabalho! Obrigado a todas e todos! https://t.co/FQskxh2FvX; ;56;443; ; ;
2018-03-17 13:42:31;Me encontro hoje, 16h, com a Frente Favela Brasil. Vamos conversar sobre o Brasil e este grave momento que vive nosso país. https://t.co/FD9fmLTIKf; ;59;355; ; ;
2018-03-16 22:53:06;Entrevista que concedi para Reuters. Sobre a venda do nosso petróleo:   “O que eu estou querendo dizer, na verdade, é o seguinte: não comprem, esperem um pouco, o país vai se recelebrar”.  https://t.co/Kqhny4e0dn; ;100;388; ; ;
2018-03-16 15:50:08;Um abraço fraterno no amigo e guerreiro brasileiro, Carlos Lupi, presidente nacional do PDT, que faz aniversário hoje. Desejo muita saúde, paz e que prossiga com essa lucidez e garra.   Na foto, sob as bênçãos de Padre Cícero! https://t.co/hAniArxkmT; ;14;162; ; ;
2018-03-16 14:00:48;Ato de filiação de Chico D’Angelo ao PDT.   Bem vindo! https://t.co/9Hp1XLaeJc; ;13;146; ; ;
2018-03-15 11:44:05;https://t.co/szc7bB9HW7; ;148;833; ; ;
2018-03-14 13:16:46;Durante evento na Câmara Americana de Comércio. https://t.co/3uyw7CgNMC; ;40;305; ; ;
2018-03-12 11:52:47;Bom dia! Hoje, às 20h, estarei na Casa do Saber, em São Paulo.   Participe!  https://t.co/TQ1ryZdcnF; ;35;299; ; ;
2018-03-11 15:33:42;Entrevista com Nelson Marconi, coordenador do programa de governo que estamos construindo com a ajuda de muitas pessoas do Brasil todo.  https://t.co/3XHu4b2Uvs; ;111;405; ; ;
2018-03-09 01:40:56;Com a força de todas e todos vocês, vamos lutar por um Brasil mais justo!  https://t.co/LTqIVfypKF; ;195;988; ; ;
2018-03-08 14:58:14;RT @PDT_Nacional: #Diversidade PDT Diversidade celebra vitória das pessoas trans no STF e no TSE. https://t.co/Dk583WRYUF #SomosTodosPDT #P…;PDT_Nacional;0;0;#SomosTodosPDT, #Diversidade;PDT_Nacional;
2018-03-08 11:47:50;Dia das mulheres. Dia de Luta. Com Miguelina, vice-presidente nacional do PDT e presidente da AMT  Lígia, vice-governadora da Paraíba  Creuzeli, Movimento Negro (PDT)  Martha Rocha, dep estadual (RJ)  Paulinha, prefeita de Bombinhas (SC). Zezé, Movimento dos Aposentados (PDT) https://t.co/yfJ8ZI6djb; ;56;400; ; ;
2018-03-07 23:37:28;Junto com a força da juventude! https://t.co/dwh8fxptGA; ;123;883; ; ;
2018-03-07 00:51:39;Debate com professores e estudantes em defesa da Universidade de Brasília (UNB). https://t.co/ulpeG7nES6; ;68;632; ; ;
2018-03-04 00:14:40;https://t.co/eefFkh3upJ; ;93;1050; ; ;
2018-03-02 11:11:35;Padre Cícero. Juazeiro do Norte. Ceará. https://t.co/GtzHf1fSDl; ;36;544; ; ;
2018-03-01 10:15:35;Bom dia! Após dois dias em Santa Catarina, já estou a caminho do Cariri cearense. Hora de falar dos desafios para o futuro do Ceará e do Brasil.  Participe! https://t.co/R9MOl47qX3; ;37;298; ; ;
2018-03-01 00:58:41;Participei agora de ato de filiação ao PDT de muitas companheiras e companheiros de Santa Catarina.  Gente de luta e apaixonada pelo Brasil! https://t.co/28iqLwaWzK; ;24;327; ; ;
2018-02-28 12:08:00;Bom dia. Permaneço hoje em Santa Catarina. Estarei às 15h na Associação Empresarial de Xanxerê (Acix) e participarei de debate com professores e estudantes na Unoesc.  Participe!; ;21;369; ; ;
2018-02-27 13:18:04;Bom dia! Nesta terça-feira vou ao município de Caçador, em SC. Às 16h participarei de um encontro com empresários na Associação Empresarial de Caçador (ACIC) e, às 19h, participo de debate com professores e estudantes na Universidade Alto Vale do Rio do Peixe (Uniarp) Participe!; ;31;374; ; ;
2018-02-26 11:37:09;Vamos conversar sobre o Ceará e sobre o Brasil!  Participe! https://t.co/5j5LE1iod9; ;41;338; ; ;
2018-02-22 11:00:58;Bom dia! Participo hoje, 18h, do II seminário das Câmaras Municipais e Vereadores de Minas Gerais. Vamos conversar sobre os desafios do Brasil e os reflexos nos municípios.   O evento será na Câmara Municipal de Conceição do Mato Dentro (MG).; ;38;454; ; ;
2018-02-17 04:14:35;Precisamos continuar a discutir este fato grave que foi a intervenção federal na segurança pública do Rio de Janeiro. Luiz Eduardo Soares fala e me interpreta. Representa o que penso. Vamos continuar conversando sobre isto. É importante!  https://t.co/ybqSif7nC6; ;105;505; ; ;
2018-02-16 23:02:14;Nota completa:  https://t.co/bxZpw6AWSe; ;41;143; ; ;
2018-02-16 22:47:25;(...)Um jovem soldado morto pelas milícias, por policiais corruptos ou pelas falanges do narcotráfico e ou facções criminosas é fato comovente q podemos esperar ao se envolverem tropas sem nenhum treinamento em segurança pública. Torço muito que possa dar certo, mas duvido muito!; ;75;370; ; ;
2018-02-16 22:46:14;(...)A corrupção no aparelho policial do Rio, e do Brasil vai procurar caminhos para se relacionar com o Exército. Repelir o inimigo é tarefa muito diferente de formar a culpa e condenar criminosos. (...); ;49;207; ; ;
2018-02-16 22:45:46;(...) Faz tempo que nações poderosas querem que as forças de defesa de países como o Brasil abandonem sua missão institucional para se converterem em forças de segurança pública e combate ao narcotráfico. Não podemos aceitar isto! (...); ;82;269; ; ;
2018-02-16 22:45:18;(...) Mas deve saber, com clareza, que sem os meios corretos, sem inovações institucionais profundas, sem uma convergência com um ministério publico e um poder judiciário muito diferentes do que temos, por media, sua tarefa corre muitos riscos (...); ;36;160; ; ;
2018-02-16 22:44:57;(...) O general a quem se atribuiu a penosa tarefa, Walter Braga Neto, é o que há de melhor em nossas forças armadas. Sério, competente e com elevado espírito publico, deve ter o apoio de todos nós (...); ;72;396; ; ;
2018-02-16 22:43:56;(...) de facções criminosas organizadas e empoderadas por anos de conivência e omissões de governos dos principais estados brasileiros em sua origem(...); ;33;164; ; ;
2018-02-16 22:42:40;(...)anti-nacional e pela metástase da corrupção generalizada. Mas corresponde a uma súplica generalizada da sociedade brasileira que anda com medo e com justíssima queixa de seus governantes impotentes diante do crime e da violência banalizados e da crescente audácia (...); ;49;193; ; ;
2018-02-16 22:41:28;(..)Biombo para o fracasso politico da malfadada reforma da previdência que de reforma nada tem, trata-se de uma aposta irresponsável num centro importante de irradiação politica para retirar da absoluta ilegitimidade politica um governo caracterizado por uma agenda anti-povo(..); ;80;332; ; ;
2018-02-16 22:39:59;Não andam fáceis as coisas para os brasileiros. Em nenhuma área. Agora temos que  entender a intervenção federal na segurança pública no Rio de Janeiro. Ninguém duvide: a motivação é mesquinha e politiqueira (...); ;468;1825; ; ;
2018-02-14 19:59:17;Quase completamente refeito da cirurgia no nariz (septo nasal) vi o desfile das escolas de samba do Rio de Janeiro. Me emocionei muito especialmente com até então modesta TUIUTI. Mas também Beija Flor e Mangueira. Deu vontade de gritar pro mundo ouvir: VIVA O POVO BRASILEIRO!; ;217;1666; ; ;
2018-02-06 18:02:10;Temos que identificar os deputados que pensam em aprovar essa criminosa reforma da previdência. Ligue, mande e-mail, entre no facebook. Eles só conhecem uma linguagem: votou contra o povo, não vai ter voto na próxima eleição!  https://t.co/fWpbf10fyC; ;320;1075; ; ;
2018-02-06 10:53:25;A Lei criada por Caó é considerada a mais rigorosa do mundo para combater o racismo. Caó foi um lutador, sobrevivente da perseguição da ditadura e deixa sua marca eternizada na história como autor da ferramenta jurídica de combate ao racismo no Brasil. https://t.co/CpEWcl5xrt; ;66;377; ; ;
2018-01-26 00:15:38;Feliz aniversário, São Paulo!   Terra que conecta a força e o espírito lutador de todos os brasileiros. Lugar onde a superação de quem trabalha e produz nos inspira a celebrar juntos novos caminhos a cada ano. https://t.co/UnJlfaU6Q4; ;22;353; ; ;
2018-01-25 11:22:09;Nota: Ciro Gomes realizou na manhã desta quinta-feira (25/01), em Fortaleza, uma cirurgia do septo nasal para corrigir um desvio. Nada grave, mas que permitirá maior conforto respiratório. O procedimento foi realizado com sucesso. Ciro está bem e deve ficar 10 dias em recuperação; ;41;873; ; ;
2018-01-24 23:33:20;https://t.co/tXPtIieSoX; ;299;1364; ; ;
2018-01-23 20:43:21;Junto com o presidente do PDT, Carlos Lupi, me reuni hoje com os amigos Paulo Câmara, governador de Pernambuco, e Geraldo Julio, prefeito do Recife. Participaram também os companheiros Wolney e Zé Queiroz.  Momento importante de reflexão sobre o Brasil.  Foto: Hélia Scheppa https://t.co/rudEEq7HPD; ;49;458; ; ;
2018-01-21 16:48:42;https://t.co/bP9pv6cHXy; ;259;887; ; ;
2018-01-13 23:16:11;Artigo de Cid Gomes para a Carta Capital. 'É preciso alertar ao nosso povo que este ajuntamento de corruptos se prepara para as eleições de 2018. Eles não vão querer largar o osso e usarão das piores táticas para fraudar ou impedir um pleito justo”. https://t.co/Yh6jEB3HxV; ;178;577; ; ;
2018-01-01 14:19:03;Uma mensagem de amor ao Brasil e aos irmãos e irmãs brasileiros. https://t.co/SDTgYF7acm; ;150;849; ; ;
