Data;Texto;Autor(RT);Retweets;Curtidas;Hashtags;Mentions
2018-01-25 16:50:37;Mais um dia de muito trabalho no Fórum Econômico Mundial. No vídeo, um resumo das atividades de hoje direto de Davos. https://t.co/Qcu7WOFEyl; ;37;283; ; ;
2018-01-25 11:32:33;Compartilho trecho da entrevista que concedi à rede americana @CNBC. A importância das reformas e as projeções de crescimento para a economia brasileira em 2018 estiveram em pauta. https://t.co/AAGe05UUnp; ;79;388; ;CNBC;
2018-01-24 16:01:12;https://t.co/qmVJcTpqC6; ;34;205; ; ;
2018-01-24 12:31:13;Participando, agora, do painel 'Diálogo sobre a estratégia do Brasil' aqui no Fórum Econômico Mundial em Davos @WEF. https://t.co/XWjfyqM5yH; ;12;133; ;wef;
2018-01-23 21:40:40;Caros, agora, estou também no Facebook. Me acompanhem por lá: https://t.co/eisI0O3JJC https://t.co/EeIogEKIBB; ;35;265; ; ;
2018-01-23 10:01:15;Tive uma excelente reunião com o ministro das Finanças do Reino Unido @PhilipHammondUK. Assista ao vídeo e conheça os principais assuntos da área econômica que tratamos entre os dois países. https://t.co/dCGK2vvqsz; ;52;274; ;PhilipHammondUK;
2018-01-22 15:28:27;Mais de 3 milhões de brasileiros que trabalharam com carteira assinada entre 1971 e 1988 têm direito a sacar o recurso. Mais informações: https://t.co/I1B0rTxgBq https://t.co/pvlgGGWlLY; ;11;97; ; ;
2018-01-22 12:40:58;Café da manhã com investidores internacionais em Londres. Todos atentos à recuperação da nossa economia e às oportunidades de investimentos no Brasil. https://t.co/hOxYSnwQxm; ;59;385; ; ;
2018-01-21 23:33:41;Hoje à meia noite vai ao ar minha entrevista ao programa @canallivre da Band. https://t.co/pSL2wFnYDg; ;45;232; ;canallivre;
2018-01-21 19:57:21;Esta semana participo em Davos do Fórum Econômico Mundial. Evento importante para trazer novos investimentos e aumentar a inserção internacional do Brasil. https://t.co/jsViEe6Sxn; ;26;188; ; ;
2018-01-21 18:07:22;Os resultados mostram que saímos da maior recessão da história e seguimos avançando na direção certa. https://t.co/5f7RK35prl; ;96;475; ; ;
2018-01-18 21:59:16;Vivemos recentemente a pior crise da nossa história. O país voltou a crescer em 2017 e este ano o PIB crescerá próximo a 3%. É uma retomada sólida em um curto espaço de tempo que está recuperando empregos e o poder de compra dos brasileiros. https://t.co/jql61CpFHz; ;127;426; ; ;
2018-01-18 16:22:50;No início de 2017, as projeções indicavam crescimento de 0,5% do PIB para o ano. https://t.co/ez9BEoGL37; ;34;198; ; ;
2018-01-18 11:04:23;Bom dia. Ao vivo agora na rádio Metrópole de Salvador conversando com os nossos amigos da Bahia. Acompanhe! https://t.co/eVaBm8akp3; ;3;67; ; ;
2018-01-16 18:48:32;Confiança dos investidores em alta com a economia brasileira. Esse novo recorde da bolsa de valores se traduz em mais investimentos e mais empregos. https://t.co/xK5IRpl4BG; ;81;370; ; ;
2018-01-16 16:19:38;Além das grandes reformas estruturais, há um intenso trabalho em curso de desburocratização que fará o país produzir mais e melhor. Confira no vídeo. https://t.co/Dtdorkapxr; ;53;276; ; ;
2018-01-15 22:12:43;O PIB cresceu fortemente em novembro, segundo o IBC-BR, que é o índice de crescimento do PIB calculado pelo Banco Central. https://t.co/L4KjHRWarq; ;40;189; ; ;
2018-01-15 16:17:49;Dos 22 segmentos industriais pesquisados, 18 apresentaram crescimento na comparação com o mesmo período de 2016. A atividade industrial segue em franca recuperação. https://t.co/kysJxN0ss3; ;29;169; ; ;
2018-01-15 12:08:19;Algumas projeções da @CNI_br para a economia brasileira em 2018. Seguindo o caminho de implantação das reformas e modernização da economia, os resultados tendem a ser ainda melhores. https://t.co/hIETudjqqI; ;45;190; ;CNI_br;
2018-01-14 15:13:11;Confira no vídeo a evolução das despesas do governo federal nos últimos 25 anos e o impacto do Teto de Gastos para o equilíbrio das finanças públicas. https://t.co/nK8RjZku7P; ;79;239; ; ;
2018-01-14 11:30:43;'O governo espera uma retomada do mercado de trabalho em 2018, com uma geração de cerca de 2,5 milhões de postos de trabalho, enquanto o PIB deve avançar 3% neste ano'. https://t.co/qigSxVzh7u https://t.co/FHvHah5gOT; ;35;189; ; ;
2018-01-13 17:45:21;Seguimos avançando. https://t.co/CQnA19VJUu; ;65;302; ; ;
2018-01-12 00:21:47;Leia a nota oficial do Ministério da Fazenda sobre a revisão da nota de crédito pela S&amp P: https://t.co/0ZdIcpeoh5 https://t.co/yd85uIkFWr; ;48;160; ; ;
2018-01-11 22:03:15;O crescimento nas exportações de carros foi destaque na imprensa internacional. Elas cresceram 46,5% em 2017. https://t.co/74QJ9Wjs7h; ;33;183; ; ;
2018-01-11 16:06:25;https://t.co/kTKw7bQqJ1; ;71;333; ; ;
2018-01-11 12:26:17;Ao vivo agora com @DatenaOficial na @RBandeirantes. Acompanhe!  https://t.co/VlAdUXLODS; ;7;77; ;DatenaOficial, RBandeirantes;
2018-01-11 11:16:40;Inflação sob controle é vital para todos porque: 👉 Preserva o poder de compra e protege, sobretudo, as pessoas mais pobres. 👉 Permite que todos possam planejar melhor suas vidas. https://t.co/fhlnaQPUtA; ;97;491; ; ;
2018-01-10 17:07:20;O índice reflete o otimismo com a economia e os planos de contratação das empresas para os próximos meses. Um ótimo sinal para a geração de empregos em 2018. https://t.co/acFPgKGlgm; ;63;253; ; ;
2018-01-10 13:04:54;Mais uma importante medida do governo para reduzir gastos e tornar mais eficientes os serviços públicos. https://t.co/U7X8YQf3s5; ;144;714; ; ;
2018-01-09 16:21:08;Das atividades do comércio varejista pesquisadas, estas foram as que apresentaram maior crescimento. 👇 https://t.co/mFONRhuRdt; ;27;112; ; ;
2018-01-09 15:36:34;Este foi o crescimento das vendas do comércio em novembro. Se considerarmos o dado de 'varejo ampliado' que inclui veículos e material de construção, o resultado foi ainda melhor, +8,7%. https://t.co/I1quFktCJq; ;47;230; ; ;
2018-01-08 17:43:58;Junto com o Ministro Dyogo do @PlanejamentoBR, participo agora de entrevista coletiva à imprensa. Acompanhe ao vivo: https://t.co/p42zQZhuJ8; ;19;107; ;planejamentobr;
2018-01-07 12:24:23;A economia brasileira começou 2018 com o pé direito. Confira alguns resultados! https://t.co/zshKQYlL2k; ;79;317; ; ;
2018-01-06 18:35:56;Se em 2015 e 2016 os brasileiros sacaram seus recursos da poupança para se proteger da crise, com a melhora da economia em 2017, já foi possível voltar a poupar. https://t.co/6jEX3tM8YF; ;50;236; ; ;
2018-01-05 22:18:52;Sobre o risco Brasil: 👉 Caiu mais da metade desde a mudança de governo. 👉 Segue caindo e, com isso, o Brasil atrairá mais investimentos. https://t.co/I2CCbYko8v; ;107;392; ; ;
2018-01-05 18:38:40;Após 4 anos de queda, a venda de veículos cresceu fortemente em 2017 e as previsões para 2018 são ainda melhores. https://t.co/SoCU36BghI; ;42;225; ; ;
2018-01-05 13:13:21;Indústria segue em franca recuperação, apontam os dados do IBGE de novembro. Comparado ao mesmo período de 2016:   - Houve expansão em 20 dos 26 ramos pesquisados - Veículos automotores cresceram 18,8% - Eletrodomésticos da linha branca cresceram 18,6% https://t.co/8bdngvaxlw; ;43;232; ; ;
2018-01-04 19:06:39;@silvioluiz @Caixa 4. Quando aquela prática aconteceu, tivemos problemas sérios, com consequências graves para o país. Em 2015, a Petrobras assumiu 60 bi de prejuízo por ações eleitorais com o preço da gasolina.; ;2;12; ;Caixa, silvioluiz;
2018-01-04 19:06:20;@silvioluiz @Caixa 3. Agora, os preços são definidos pela Petrobrás, baseada nos custos do petróleo no mercado internacional, e não mais por critérios políticos.; ;2;14; ;Caixa, silvioluiz;
2018-01-04 19:06:00;@silvioluiz @Caixa 2. Mas nesse governo, ao contrário de outros momentos, os preços da gasolina não são definidos pelo Ministério da Fazenda.; ;3;11; ;Caixa, silvioluiz;
2018-01-04 19:05:46;@silvioluiz @Caixa 1. Os preços da gasolina estão mais altos do que todos gostaríamos.; ;3;12; ;Caixa, silvioluiz;
2018-01-04 15:34:53;Tenho dito reiteradas vezes que só decidirei sobre candidatura em abril. Meu foco está 100% voltado ao meu trabalho de organizar as contas públicas, fazer a economia crescer e gerar mais empregos.; ;129;1044; ; ;
2018-01-04 13:25:30;O recorde da bolsa de valores e sua evolução nos últimos meses acompanha o processo de recuperação e de otimismo com a nossa economia. Isso significa mais investimentos nas empresas e mais empregos para os brasileiros. https://t.co/TLvTt18xUc; ;52;299; ; ;
2018-01-03 16:06:05;Qualquer empresário, seja de grande ou pequeno porte, precisa ter confiança de que o país vai continuar crescendo para investir no seu negócio. Portanto, quanto maior a confiança, maior é o crescimento da economia.; ;85;501; ; ;
2018-01-03 16:00:37;O Índice de Confiança Empresarial (ICE) cresceu 1,2 pontos em dezembro e atingiu a melhor marca desde abril de 2014. Desde que assumimos a @FazendaGovBR, ele cresceu mais de 20 pontos. https://t.co/z3x7U7Fl6Q; ;30;157; ;FazendaGovBr;
2018-01-03 12:28:31;Em 2017, os resultados da economia brasileira superaram todas as previsões. Compartilho algumas projeções para 2018. https://t.co/3eR3HGMzCC; ;68;261; ; ;
2018-01-02 21:59:27;O Superávit Comercial de 2017 é o melhor resultado já registrado na história. As exportações voltaram a crescer pela primeira vez após 5 anos. As importações voltaram a crescer após 3 anos. A recuperação da economia segue firme e forte. https://t.co/rExUy383fF; ;86;386; ; ;
2018-01-02 19:16:29;Boa oportunidade para quem quer começar 2018 adquirindo a casa própria. A @Caixa também está elevando de 50% para 70% a cota de financiamento para compra de imóveis usados. https://t.co/dMfq5jN79J; ;40;184; ;Caixa;
2018-01-02 12:13:51;Mais um indicativo que estamos no rumo certo. 2018 será um ano de grandes resultados para o Brasil e os brasileiros. https://t.co/CDnPBK3wSB; ;38;227; ; ;
